https://www.youtube.com/watch?v=10FfGGdCcJ4,Man Ruins His Life Over Chicken Wings,674
https://www.youtube.com/watch?v=o2S2-uMGeh0,Let's Talk About Chases,437
https://www.youtube.com/watch?v=s38tx-a_jEg,This Monster Energy Lawsuit Is Nuts,525
https://www.youtube.com/watch?v=ZHGtw9d7Wl0,I'm Almost Done Watching It,1119
https://www.youtube.com/watch?v=6xW3HVSP1bY,Another Youtube Prankster Got Shot,570
https://www.youtube.com/watch?v=LwWUh2YwmK0,Moist Meter | Super Mario Bros. Movie,617
https://www.youtube.com/watch?v=QiEJWDabjn0,Yeah This Game Is Awful,1099
https://www.youtube.com/watch?v=tuLWhVM5Bkw,This Whole Industry Is Struggling,576
https://www.youtube.com/watch?v=OmLkNk3QJ4Q,Hypocrisy,725
https://www.youtube.com/watch?v=TY3M6oGvzIQ,Museum of Failure,619
https://www.youtube.com/watch?v=UDLWR0tIRIg,New Awful Twitter Changes,642
https://www.youtube.com/watch?v=zVVI4zPGInM,I Finally Watched It,1132
https://www.youtube.com/watch?v=4ewEuB6J1Jg,The Trial Is Over,559
https://www.youtube.com/watch?v=4JHifOjClN0,This Situation Is Horrible,643
https://www.youtube.com/watch?v=yg8RNSPQKAw,Goodbye E3,416
https://www.youtube.com/watch?v=E6NfX9woMYM,He Has Over 500 Children,385
https://www.youtube.com/watch?v=SE7LJc9lwW0,Gwyneth Paltrow Trial Is Nuts,991
https://www.youtube.com/watch?v=ewBJ8uw0si4,I Love Technology,535
https://www.youtube.com/watch?v=NbrGm3RLuW0,He's Doing It Again,758
https://www.youtube.com/watch?v=983reSpBg0M,Moist Meter | Resident Evil 4 Remake,637
https://www.youtube.com/watch?v=yX9J4RIsvOA,This Is Actually Scary,785
https://www.youtube.com/watch?v=IxRMuNJdpFo,They Responded,1129
https://www.youtube.com/watch?v=Oa7TkhcT4t8,This Bucket Is Horrible,504
https://www.youtube.com/watch?v=xQ_N7HY97eE,Tik Tok Congress Hearing Was Painful,751
https://www.youtube.com/watch?v=C3cqMqUV4hg,This Company is Awful,535
https://www.youtube.com/watch?v=QH5LBi8Pwq0,This is Just Stupid,543
https://www.youtube.com/watch?v=7jrffqyLaSY,Moist Meter | John Wick 4,707
https://www.youtube.com/watch?v=ZY1niNVxYg0,I Finally Listened To You,648
https://www.youtube.com/watch?v=j4S__NypEiY,Justin Roiland Situation Just Got Wild,537
https://www.youtube.com/watch?v=cyTlPkNOaKE,This Isn't Appreciated Enough,398
https://www.youtube.com/watch?v=HHoZITnEi8U,Twitch Is In Huge Trouble,826
https://www.youtube.com/watch?v=AvjlbxS71XY,This Should Make You Mad,767
https://www.youtube.com/watch?v=trydrfj__uY,This Whole Situation Was Crazy,894
https://www.youtube.com/watch?v=fjeHW0TSx6Y,This Man Is Pure Evil,1132
https://www.youtube.com/watch?v=hB4j-GPMNAI,Moist Meter | Shazam: Fury of the Gods,566
https://www.youtube.com/watch?v=h6nmGDEi-kg,These Youtubers Are Being Sued for $1 Billion,716
https://www.youtube.com/watch?v=oSKSyRmJcXk,Milk Tier List,1177
https://www.youtube.com/watch?v=HZ3i8fsdyt0,Twitch CEO Just Stepped Down,656
https://www.youtube.com/watch?v=8q4-w3CPbYM,This Roblox Game is Better Than Call of Duty,726
https://www.youtube.com/watch?v=wu6_rD2Gw_c,FaZe Is In Huge Trouble,887
https://www.youtube.com/watch?v=wSUOJgwC7rk,This Game Has Potential,1177
https://www.youtube.com/watch?v=sjC9rxq0LMc,Sneako Is Horrible,926
https://www.youtube.com/watch?v=Yy1UDBJPOu0,Moist Meter | The Last of Us Show,567
https://www.youtube.com/watch?v=Puobu8NVK7Q,Kwite Situation Is Horrible,608
https://www.youtube.com/watch?v=-ttR7bo3OaA,Huge Drama At The Streamer Awards,533
https://www.youtube.com/watch?v=yp4OvrQY9ZQ,What Is This Guy Doing,326
https://www.youtube.com/watch?v=5SfySmq20Dk,Linus Tech Tips Almost Ruined His Career,505
https://www.youtube.com/watch?v=HyEyYZ2B_nU,Dumbest Chase Ever,1119
https://www.youtube.com/watch?v=5I-jz80gYqM,Moist Meter | Scream 6,572
https://www.youtube.com/watch?v=F-jQoWf_Iv8,Hollywood is Horrible,646
https://www.youtube.com/watch?v=qYFrN9mzroY,Dr Disrespect's Game Has A Huge Problem,706
https://www.youtube.com/watch?v=bGaWJ8cz7Vw,Wildest Thing I've Ever Read,594
https://www.youtube.com/watch?v=cDJDFnuUzSI,Youtube Finally Made A Good Change,596
https://www.youtube.com/watch?v=O2ANJsC6XQc,This Tik Tok Carnivore is Unhinged,612
https://www.youtube.com/watch?v=JWJTzilVexg,Clown Influencer,653
https://www.youtube.com/watch?v=Sm32tD8ktjs,Attack on Titan is Finally Ending,883
https://www.youtube.com/watch?v=zylRUOQ6zVw,Scariest Chase Ever,1017
https://www.youtube.com/watch?v=VsXFik8VW8s,He Wants to Fight Me,1135
https://www.youtube.com/watch?v=DotRILvkfBE,Moist Wrestling League | Chainsaw vs Dow Jones,1002
https://www.youtube.com/watch?v=niTiDEK6V9s,WWE Is In Huge Trouble,495
https://www.youtube.com/watch?v=oBG1zGHvUlo,This Guy Is Pathetic,561
https://www.youtube.com/watch?v=x6vCYN9DA_Q,Gaming Is An Olympic Sport Now,542
https://www.youtube.com/watch?v=crlL4kpsBR8,This Pokimane Situation is Awful,673
https://www.youtube.com/watch?v=QKx6DAMWUDM,Proof Elves Are Real,416
https://www.youtube.com/watch?v=Ytm8VsQPS3o,Goofiest Lawsuit Ever,506
https://www.youtube.com/watch?v=L_si9NyPUAI,This Is Horrible Content,403
https://www.youtube.com/watch?v=ikoUJ-1s3lw,A Lot to Talk About Today,543
https://www.youtube.com/watch?v=2QTzUii5mII,Adin Ross Got Banned,717
https://www.youtube.com/watch?v=zLP28DvnjoY,Disgusting Youtuber in Prison for 10 Years,548
https://www.youtube.com/watch?v=zAnsCdeP60c,Most Embarrassing Streamer Ever,549
https://www.youtube.com/watch?v=Sxv5oPoE6W4,I Can't Believe I'm Allowed To Do This,1004
https://www.youtube.com/watch?v=8P188PKze2k,Faking Good Deeds for Clout,379
https://www.youtube.com/watch?v=VBRDRvCtOOM,This Drama Had A Happy Ending,538
https://www.youtube.com/watch?v=sl2F8SH7lhg,This Invisible House is Horrible,391
https://www.youtube.com/watch?v=S78HT5j-WqM,I Learned About the DKOldies Situation,797
https://www.youtube.com/watch?v=yLYDgGXMPnA,Goofiest Drama Ever,845
https://www.youtube.com/watch?v=Jntxq5QxR-0,No Youtuber Should Ever Do This,702
https://www.youtube.com/watch?v=QPR8J5aiJ28,My Least Favorite Twitch Streamer,410
https://www.youtube.com/watch?v=qOAb3IepphE,This Game Costs Thousands of Dollars to Play,544
https://www.youtube.com/watch?v=3Q5Yh7WW6xg,Moist Meter | Ant-Man and the Wasp: Quantumania,489
https://www.youtube.com/watch?v=b1vTbYMN3EU,New Youtube CEO is Scary,413
https://www.youtube.com/watch?v=U74Yrzw5XQ0,Youtube CEO Steps Down,538
https://www.youtube.com/watch?v=KeZxaNZ-is8,Netflix Just Won't Stop Making Horrible Changes,666
https://www.youtube.com/watch?v=lMRJuijUCWw,Dating Guru Courses Are Sad,804
https://www.youtube.com/watch?v=IRhQJQHUD4Q,Why Is This Happening So Often,1014
https://www.youtube.com/watch?v=ocrjkwtF-e4,Creepiest Youtuber Ever is Finally Being Sued,385
https://www.youtube.com/watch?v=sX7q-PGi4Gk,This Scammer Needs To Be Stopped,1125
https://www.youtube.com/watch?v=8eqWSmv2VDs,Was The Super Bowl Rigged,496
https://www.youtube.com/watch?v=SH6sSypXucA,UFOs Are Being Seen Everywhere,495
https://www.youtube.com/watch?v=6NlqaE9hvPw,Huge Scammer Just Got Scammed,958
https://www.youtube.com/watch?v=TM2vSe4T-NI,Goofiest Chase Ever,739
https://www.youtube.com/watch?v=oOhQJitx390,Embarrassing Youtuber Drama,712
https://www.youtube.com/watch?v=wEynnVWbSSg,I Forgot Again,925
https://www.youtube.com/watch?v=2uX6J9jLX3c,I Had A Meltdown on Twitch,744
https://www.youtube.com/watch?v=AKQExWE_o5g,Dhar Mann is in Huge Trouble,685
https://www.youtube.com/watch?v=y2HlZ2m3SIg,This Youtuber Just Solved the Mysteries of the Universe,301
https://www.youtube.com/watch?v=mDyWefoWbcc,Nobody Likes This Guy,917
https://www.youtube.com/watch?v=1-kBDK0dx-c,I'm Training for A Youtuber Boxing Match,720
https://www.youtube.com/watch?v=xXMURkp8mCo,Walmart Has A Huge Problem,486
https://www.youtube.com/watch?v=NTvGLtIChLc,Most Evil Streamer Ever,500
https://www.youtube.com/watch?v=iXE_udlBFEk,Netflix Gave Up,491
https://www.youtube.com/watch?v=_5h8EtyCXjI,Huge Fake Game Scam,715
https://www.youtube.com/watch?v=NbnVn5vmA2I,This Technology Will Scare You,706
https://www.youtube.com/watch?v=merbANJ7eV0,I've Been Silent About This for Too Long,502
https://www.youtube.com/watch?v=VabiWw1deR8,Netflix Just Made the Worst Change Ever,531
https://www.youtube.com/watch?v=COZCHQkMsxM,Horrible Streamer Deepfake Situation,733
https://www.youtube.com/watch?v=GdK4hJPQ-5A,War Is My Playground,552
https://www.youtube.com/watch?v=2o-sDpKx47I,Let's Talk About the MrBeast Drama,695
https://www.youtube.com/watch?v=5c7OK3xmGpE,"My New $10,000 Speedrun Challenge",514
https://www.youtube.com/watch?v=6ONAMoxIQ8E,This Needs to Stop,737
https://www.youtube.com/watch?v=OKm5I9AHwAw,You're Dumb If You Buy This,529
https://www.youtube.com/watch?v=xqd3ZbCJ2so,I Just Lost A Major Partnership,581
https://www.youtube.com/watch?v=W1ZASTe5RTo,Moist Meter | Forspoken,806
https://www.youtube.com/watch?v=h27CM99STLg,I'm Not That Stupid,549
https://www.youtube.com/watch?v=CYHQ5iSLwME,Goodbye M&Ms,503
https://www.youtube.com/watch?v=LNGbLMctfRQ,I Need to Talk About This,340
https://www.youtube.com/watch?v=5QiW4kOxXVg,Rick and Morty Fired Justin Roiland,496
https://www.youtube.com/watch?v=4EaUqKdiN9Y,Journalists Hate Gaming,1067
https://www.youtube.com/watch?v=GOOV6jtu9ac,Most Delusional Man Ever,571
https://www.youtube.com/watch?v=gwnBkqoJpps,This is a Pathetic Scam,697
https://www.youtube.com/watch?v=tIRcVgBovd0,Weirdest Dating Show Ever,497
https://www.youtube.com/watch?v=3QyMbARxEQA,We Almost Ruined Netflix's Biggest Dating Show,704
https://www.youtube.com/watch?v=r9hMaAP00TU,People Are Mad At Me,545
https://www.youtube.com/watch?v=L4ObjsuumPA,Mud Wizard Traps Entire Police Department,779
https://www.youtube.com/watch?v=1ePFRHUimmY,The End of Logan Paul's Biggest Scam,903
https://www.youtube.com/watch?v=ayn5H9APWlA,Finally Time to Talk About This Situation,414
https://www.youtube.com/watch?v=zSAbNESaLVA,This Scary Game Made Me Ruin My Pants,928
https://www.youtube.com/watch?v=vrxaZRE6wRI,Hate Watching,539
https://www.youtube.com/watch?v=5K0DyMpxpUk,Everyone is Talking About This Slap,346
https://www.youtube.com/watch?v=vqKiSAiwNCA,Justin Roiland Situation is Awful,495
https://www.youtube.com/watch?v=Frevlg_nR8E,Last of Us Show is Actually Good,545
https://www.youtube.com/watch?v=WSajrpywoGo,Pink Sauce Just Won't Go Away,564
https://www.youtube.com/watch?v=VcnJNsqRbq8,I Ruined A Kids Racing Game,721
https://www.youtube.com/watch?v=rRXOzT4eN4U,Velma is Worse Than I Expected,548
https://www.youtube.com/watch?v=q0zm3KR_a4E,Velma Show Looks Horrible,596
https://www.youtube.com/watch?v=ij8rwTPwjPI,People Actually Believe This is Real,701
https://www.youtube.com/watch?v=Tu8a-j8QNAY,The Gentle Men - Filthy,135
https://www.youtube.com/watch?v=HkHVNhargbQ,Girlfriend Horror Game,1129
https://www.youtube.com/watch?v=uuVU3rga8_Y,This Tik Tok Detective is Horrible,687
https://www.youtube.com/watch?v=theX2ri4B_s,We Have A Winner,953
https://www.youtube.com/watch?v=lGbcHyQ2v3c,Most Delusional Company Ever,762
https://www.youtube.com/watch?v=-6pq_b1sQDo,This is a Horrible Gym,346
https://www.youtube.com/watch?v=smCcIFiVU1A,Another Huge Scam Just Got Exposed,576
https://www.youtube.com/watch?v=zlu6_OsTDF0,I Am Jesus Christ is Finally Out,727
https://www.youtube.com/watch?v=rPz7txNekvU,Huge Waffle House Drama,385
https://www.youtube.com/watch?v=ImDqk8nylos,How Horrible is the Lowest Rated Netflix Original,661
https://www.youtube.com/watch?v=C9p7WO01yA8,Moist Meter | M3GAN,375
https://www.youtube.com/watch?v=srzNr46Pbgc,Disgusting Twitter Posts Cost Them a Job,425
https://www.youtube.com/watch?v=DUcD_A-GZfY,Tik Tok Detective Tries to Ruin Innocent Woman's Life,934
https://www.youtube.com/watch?v=bf9H77-l3EI,Professional Fighting in a Hot Car,581
https://www.youtube.com/watch?v=KkIN74s1kMw,Youtube Change is Worse Than I Thought,720
https://www.youtube.com/watch?v=CkxROYQdHlk,2005 Games Were So Different,444
https://www.youtube.com/watch?v=velClhsQXnA,Biggest Ratio in Twitter History,443
https://www.youtube.com/watch?v=rKQHONbmg80,The Worst 5 Games of 2022,734
https://www.youtube.com/watch?v=oWzc8gZb634,This Game is $120 on Steam,318
https://www.youtube.com/watch?v=SF7py8lYAaQ,Weirdest Channel on Twitch,784
https://www.youtube.com/watch?v=38ycLyFYsFg,I Want to Buy Machinima,543
https://www.youtube.com/watch?v=5xBatg_H0Zs,Hardest Speedrun Ever,1039
https://www.youtube.com/watch?v=Yv3a7Pfy_l4,Huge Youtube Change Just Ruined Many Channels,601
https://www.youtube.com/watch?v=3O6_DLQlDjg,Crazy Day,862
https://www.youtube.com/watch?v=2rhslYeQyaM,Andrew Tate Got Arrested,522
https://www.youtube.com/watch?v=E2AnFxVo4Z8,One Scream Ruined His Career,432
https://www.youtube.com/watch?v=ygNXl1tybQc,I'm in a Huge Lawsuit,509
https://www.youtube.com/watch?v=pOLxsP4jLYE,Moist Meter | Chainsaw Man,387
https://www.youtube.com/watch?v=74ZW_OOHZLc,"My $10,000 Speedrun Challenge",567
https://www.youtube.com/watch?v=hhLKbmIKML4,The Best 5 Movies of 2022,722
https://www.youtube.com/watch?v=6I6JuZXl2RM,Tik Tok Scammers Are Out of Control,627
https://www.youtube.com/watch?v=fF_QrYq4CWI,Joe Rogan Made A Huge Mistake,664
https://www.youtube.com/watch?v=_25eQcC8uvY,Finally A Good Ending,667
https://www.youtube.com/watch?v=A3ZXFA1l9oQ,Most Confusing Chase Ever,721
https://www.youtube.com/watch?v=iYc3OVxmLU8,Salt Bae is Cringe,558
https://www.youtube.com/watch?v=90TuYS19yCM,Dark and Darker is Amazing,973
https://www.youtube.com/watch?v=ASMJKpmAYQQ,People Got Very Mad About This,453
https://www.youtube.com/watch?v=NFu3tvqWfEA,I Finally Tried Warhammer,533
https://www.youtube.com/watch?v=pY2ZzXWQL1A,Twitch Chat Ruined His Life,573
https://www.youtube.com/watch?v=xTD2Xcxr7SI,I Failed You,367
https://www.youtube.com/watch?v=kkfqdTOF9j0,Choo Choo Charles is Nuts,869
https://www.youtube.com/watch?v=2JGKPiIi4Rk,Pretending to Save Someone's Life,487
https://www.youtube.com/watch?v=9YjrEe2Ue3I,We Made History,732
https://www.youtube.com/watch?v=JlLUp8I7qOo,Rating Markiplier's OnlyFans,432
https://www.youtube.com/watch?v=MVDuzHC0AhQ,Christmas Came Early,890
https://www.youtube.com/watch?v=ou_O5X0jTRM,Moist Meter | Avatar: Way of Water,548
https://www.youtube.com/watch?v=LvhJC7cmjZ8,This Tik Tok Star Just Ruined Her Career,561
https://www.youtube.com/watch?v=TNPrrkOKnjA,Streamer Gets Angry and Makes Horrible Apology Video,902
https://www.youtube.com/watch?v=P0s-8eIHqi4,He Finally Got Arrested,965
https://www.youtube.com/watch?v=v0d2Ns_WRl4,I Almost Fought in This,634
https://www.youtube.com/watch?v=Qpoln2ilsgY,Elon Musk Ruins A Comedy Show,629
https://www.youtube.com/watch?v=3iQ8RXhkNwQ,Game Journalists Might Lose Their Job to AI,772
https://www.youtube.com/watch?v=860QalgnhRM,The Game Awards Situation,488
https://www.youtube.com/watch?v=P2UIgetkE1o,Wild Day,414
https://www.youtube.com/watch?v=0aw6HMw1Ozs,This Guy Escaped During a Police Chase,525
https://www.youtube.com/watch?v=JIws3uCFvWU,I've Done It Again,566
https://www.youtube.com/watch?v=kquf5Jus_e4,Nobody Saw This Coming,410
https://www.youtube.com/watch?v=kahphOX1EmE,This Horror Game Fooled Me,817
https://www.youtube.com/watch?v=vujnNFFbMso,This Drama Just Got Crazy,802
https://www.youtube.com/watch?v=8-nOHIK2haM,Goofiest Commercial Ever,341
https://www.youtube.com/watch?v=8PbZjHyKiyo,Youtuber Gets Called Out and Goes Nuts,539
https://www.youtube.com/watch?v=oOvnQpQGvmk,Another Big Nintendo L,925
https://www.youtube.com/watch?v=rKeZdaofDts,He Apologized,671
https://www.youtube.com/watch?v=r7bNy-6GU0I,Talking About Everything That's Happened,647
https://www.youtube.com/watch?v=z6JedapbLqI,Biggest Liar,644
https://www.youtube.com/watch?v=QbxbezW2Lj0,Horrible Day,383
https://www.youtube.com/watch?v=pUVv8c28pAM,Most Confusing Video Ever,666
https://www.youtube.com/watch?v=JnSZTPA9x9M,Proving You Wrong,772
https://www.youtube.com/watch?v=GZguBBq-oe8,Youtuber's Life in Danger,472
https://www.youtube.com/watch?v=ggnl5HpLOZM,I Didn't Want to Talk About This,726
https://www.youtube.com/watch?v=F-AXJ-gMlPU,80s Anti Bullying Videos Are Wild,535
https://www.youtube.com/watch?v=Ke9PC26qeY0,He Just Keeps Making It Worse,519
https://www.youtube.com/watch?v=JrhWkZmvFvY,Souls-Like Games Are Too Easy,1153
https://www.youtube.com/watch?v=Z75EzmrjKL8,Food Reviews Are Nuts,564
https://www.youtube.com/watch?v=Ii4UsT9EkjM,Worst Response Ever,884
https://www.youtube.com/watch?v=_1Jy_KAT14E,Warzone 2 is Broken,1097
https://www.youtube.com/watch?v=e_VL-a3NJiI,This Guy is a Joke,1040
https://www.youtube.com/watch?v=nm52GaVuvlw,This is Getting Ridiculous,652
https://www.youtube.com/watch?v=ATi6T6_570I,Pokemon Scarlet/Violet is Embarrassing,1156
https://www.youtube.com/watch?v=oy_a5KI29tg,Worst Teachers Ever,562
https://www.youtube.com/watch?v=0oN48sVfy4g,Moist Meter | God of War Ragnarok,598
https://www.youtube.com/watch?v=v44jfODHyQA,Huge Bethesda Drama,868
https://www.youtube.com/watch?v=ERwpSmrQY5M,Never Thought I'd Achieve This,821
https://www.youtube.com/watch?v=fUGlPYwUWco,I Don't Need GTA 6 Anymore,1120
https://www.youtube.com/watch?v=31ecnjUkyqo,My Dad is a Real Gamer Now,530
https://www.youtube.com/watch?v=vMAoP7Jlnw4,I Have To Stop,659
https://www.youtube.com/watch?v=FHk029I-2pE,Companies Just Lost Billions From Twitter Trolls,531
https://www.youtube.com/watch?v=C2ZHs55TMZc,Huge L for Cryptocurrency,1169
https://www.youtube.com/watch?v=Ka4v0wAmzD0,Worst Prank Channel Ever,512
https://www.youtube.com/watch?v=50Qw55jsW7c,God of War Ragnarok is Amazing,1042
https://www.youtube.com/watch?v=yEocR0QeeCg,Moist Meter | Black Panther: Wakanda Forever,527
https://www.youtube.com/watch?v=tzMFW9RWTnI,Huge Trouble for Bang Energy,1191
https://www.youtube.com/watch?v=Bm-P8Ux-ByA,Roblox Developer Facing Two Life Sentences,970
https://www.youtube.com/watch?v=zNjWKrP_tS0,Moist Meter | Sonic Frontiers,619
https://www.youtube.com/watch?v=TjKoGrJ-FuY,Creepiest Guy I've Ever Seen,714
https://www.youtube.com/watch?v=X1rj6VfmXbk,Sonic Frontiers Is Pretty Good So Far,1180
https://www.youtube.com/watch?v=1aZR_XX7eGY,Desperate for Clout,327
https://www.youtube.com/watch?v=ZZqnPnESGYM,Worst IGN Reviews Ever,975
https://www.youtube.com/watch?v=l2Kw6aGBt5g,Twitter is Dying,642
https://www.youtube.com/watch?v=xdsDwWbthyQ,This Hurts to Watch,803
https://www.youtube.com/watch?v=7dio62Lk72Q,Hard Work,525
https://www.youtube.com/watch?v=maQ3XiHhuWU,Huge Youtube Leak,487
https://www.youtube.com/watch?v=aapbj1v8KKE,Dumbest Criminal Ever,563
https://www.youtube.com/watch?v=LUc81kxGs0A,Elon Musk's Worst Idea,636
https://www.youtube.com/watch?v=gRpx0IoaGDs,Huge Drama Update,660
https://www.youtube.com/watch?v=ASzgGB1h8mY,I'm Actually Nuts at Modern Warfare 2,956
https://www.youtube.com/watch?v=gEB67J-F9UU,My Craziest Idea,523
https://www.youtube.com/watch?v=Chx-Blmeq8A,Moist Meter | Call of Duty: Modern Warfare 2,614
https://www.youtube.com/watch?v=bY9yJmMzFoM,Great News,497
https://www.youtube.com/watch?v=iwQOZE15pSU,The Only Franchise I'm Passionate About,1110
https://www.youtube.com/watch?v=Bb7f7M944zw,Twitter Just Changed Forever,365
https://www.youtube.com/watch?v=K26kUMlRsYc,Tik Tok Trend Got 4 People Killed,353
https://www.youtube.com/watch?v=nL2tD1kAat0,This Auction Has Everything I've Ever Wanted,644
https://www.youtube.com/watch?v=2S7HEwRLyew,Craziest Trial Ever Just Ended,1014
https://www.youtube.com/watch?v=tyNvLm_dpug,I Made A Promise,1127
https://www.youtube.com/watch?v=shj-RgkC-aQ,I'm Tired of This,641
https://www.youtube.com/watch?v=erpgkWqV-W4,Moist Meter | House of the Dragon,592
https://www.youtube.com/watch?v=czwEEtSEmQc,Worst Hotel Guest Ever,707
https://www.youtube.com/watch?v=Mu1vgxuWfC8,This Drama is Finally Over,631
https://www.youtube.com/watch?v=x5f9ysQ_0Ao,You Deserve This,343
https://www.youtube.com/watch?v=S7SnzkewLqQ,Moist Meter | Black Adam,403
https://www.youtube.com/watch?v=xdPRMftJKbA,$100 Million Chess Drama Lawsuit,594
https://www.youtube.com/watch?v=XY9gVo37W6M,I Forgot,927
https://www.youtube.com/watch?v=qGE5XrcUaiY,Horrible Apology Documentary,566
https://www.youtube.com/watch?v=zyTC99TBr0c,We've Been Lied To,535
https://www.youtube.com/watch?v=jKo1YEPsmnY,Weirdest Dragon Ball Game Ever,713
https://www.youtube.com/watch?v=WRr-dW7l3J0,James Corden Has Been Banned,596
https://www.youtube.com/watch?v=QIxNap2WWYk,Bayonetta 3 Drama,743
https://www.youtube.com/watch?v=5Db1cNr67jg,My Biggest Injury,341
https://www.youtube.com/watch?v=949UaR2NpxI,Amouranth Situation is Horrible,1117
https://www.youtube.com/watch?v=7Lhd_E7suZ0,Scorn Is Disappointing,1071
https://www.youtube.com/watch?v=sogXd3PVpC8,Big News on the Horrible TwitchCon Injury,789
https://www.youtube.com/watch?v=xBNiHK6tBp8,Moist Meter | Halloween Ends,522
https://www.youtube.com/watch?v=CZZ4KZJ6MNA,Metaverse Is Dead,665
https://www.youtube.com/watch?v=-bb8hHpQbrE,RIP Google Stadia,725
https://www.youtube.com/watch?v=evjJ8x5ZfYU,Pink Sauce Lady Embarrassed Herself,1077
https://www.youtube.com/watch?v=pz68p6ycV3k,This Guy Has Uploaded 2 Million Videos,593
https://www.youtube.com/watch?v=dhcrimS_Vk0,This Youtube Trend Got A Whole Community Banned,323
https://www.youtube.com/watch?v=CXxcZdJzTAQ,Worst Magic Trick Ever,668
https://www.youtube.com/watch?v=okhUzMvZhpA,Youtube Keeps Trying to Remove This Video,553
https://www.youtube.com/watch?v=zQB2u92KLaY,My Full Thoughts on Overwatch 2,784
https://www.youtube.com/watch?v=IT2zu79Ukz8,Best VR Game Ever,797
https://www.youtube.com/watch?v=iIkfc2s0SqY,Horrible Injury at TwitchCon,537
https://www.youtube.com/watch?v=JrmTNbSdkUA,This Mario Level Took 7 Years to Beat,1056
https://www.youtube.com/watch?v=qp67TMyzylI,I Got Bullied by Kids,426
https://www.youtube.com/watch?v=VzMy1bbiavk,DJ Khaled Almost Died,578
https://www.youtube.com/watch?v=dxCd2t1hF4k,Dumbest Idea Ever,507
https://www.youtube.com/watch?v=3LJQQ1-hr1I,This Tour Is Nuts,546
https://www.youtube.com/watch?v=ZM52Gaqa-yQ,Goofiest Man Alive,571
https://www.youtube.com/watch?v=kJAiXDIMNac,Streamer's House Burns Down While Live,352
https://www.youtube.com/watch?v=reelBwBQgzM,This Drama is Getting Nuts,627
https://www.youtube.com/watch?v=mPKSj0ZWpxA,I'm So Glad Someone Made This,1073
https://www.youtube.com/watch?v=q54QB5go28c,I Love DJ Khaled,521
https://www.youtube.com/watch?v=dEi9t31jbnQ,Dumbest Couple on Facebook,295
https://www.youtube.com/watch?v=uOpEf1eDw0w,Dream Face Reveal,387
https://www.youtube.com/watch?v=p_PjhJyy6vA,Lunchables Tier List,1018
https://www.youtube.com/watch?v=dzday6cLAEU,Clown Behavior,938
https://www.youtube.com/watch?v=HU3F-Z99gw8,Biggest Cheating Scandal in Fishing History,563
https://www.youtube.com/watch?v=rghvq7LwxnU,Downfall of a Massive Youtuber,1099
https://www.youtube.com/watch?v=8kUT2OQKXPc,Moist Meter | Smile,531
https://www.youtube.com/watch?v=kDTALmjiFzE,Another Twitch L,691
https://www.youtube.com/watch?v=ItM_HLfPF78,This Makes Me Mad,771
https://www.youtube.com/watch?v=d3RAOWn0K8k,I Survived Jimmy Fallon Fortnite World,572
https://www.youtube.com/watch?v=8uUC7Vca8ew,Youtuber Cheating Scandal,411
https://www.youtube.com/watch?v=1kvvq6rIke4,Most Pathetic Dad on Tik Tok,406
https://www.youtube.com/watch?v=MeX26MCDAbY,Walmart Made A Roblox Game,698
https://www.youtube.com/watch?v=2nnkF9jffdY,Dumbest Thing I've Ever Seen,426
https://www.youtube.com/watch?v=fCjH134FA20,Waffle House Fights Are Nuts,550
https://www.youtube.com/watch?v=GORgoRLk3KE,Good News,685
https://www.youtube.com/watch?v=YnCyxJuFYeY,Scariest Thing I've Ever Seen,864
https://www.youtube.com/watch?v=Zmc0QUX5dDs,Moist Tournament,647
https://www.youtube.com/watch?v=kb03bi5WyDo,Endless Drama,677
https://www.youtube.com/watch?v=Y6lvRq7ewxM,I Love Horror Games Like This,805
https://www.youtube.com/watch?v=s37kKxa38RE,This Drama Just Doesn't End,931
https://www.youtube.com/watch?v=zJlHypxQT3g,Twitch is Dying,803
https://www.youtube.com/watch?v=R2NKT2zPTw4,I Need You,881
https://www.youtube.com/watch?v=BqkI3nfCLMg,Huge Twitch Drama,787
https://www.youtube.com/watch?v=IWGif6LQBJo,I Injured Masterchef Nick DiGiovanni,1075
https://www.youtube.com/watch?v=WzKHhbnY4DU,Grand Theft Auto 6 Leaked,674
https://www.youtube.com/watch?v=eMM8ZlzXF9I,Angry Employee Destroys Children's Game,441
https://www.youtube.com/watch?v=MVu-bD5keAs,AI Art is Taking Over,1056
https://www.youtube.com/watch?v=qg2CuHxmuh4,Biggest Chess Cheating Scandal Ever,878
https://www.youtube.com/watch?v=P7EssH_yiIo,Mr. Incredible Committed A Crime,356
https://www.youtube.com/watch?v=574kZm26BAM,Is Youtube Killing Twitch,784
https://www.youtube.com/watch?v=YbFJjdcz8Q4,Disney Can't Keep Getting Away with This,437
https://www.youtube.com/watch?v=uWd5qq6-kCU,I'm Building An Amusement Park,595
https://www.youtube.com/watch?v=PjYQlW_R9Ak,Moist Meter | Cyberpunk Edgerunners,393
https://www.youtube.com/watch?v=mrUs5DidtVk,My Hottest Take So Far,688
https://www.youtube.com/watch?v=iW6su_2ClTA,Dirtiest Room on Twitch,746
https://www.youtube.com/watch?v=ZN0UOB7UNaQ,How Can Someone Be This Dumb,487
https://www.youtube.com/watch?v=XiMI6GNgp28,AI Art is Scary,762
https://www.youtube.com/watch?v=l_-N445VsUg,I Have to Talk About This,298
https://www.youtube.com/watch?v=1NCjrkFd1QA,I Took A Testosterone Test,794
https://www.youtube.com/watch?v=mzfa5cZRsy8,Most Evil Singer Ever,859
https://www.youtube.com/watch?v=sFegIoX2CNU,Who Is The Worst Game Developer,598
https://www.youtube.com/watch?v=hGYameyj9_o,Hardest Roblox Game Ever,597
https://www.youtube.com/watch?v=cIwNbn3V1-M,I Don't Know What to Believe Anymore,509
https://www.youtube.com/watch?v=yyrmXQ1TLZc,Twitch Actually Did It,383
https://www.youtube.com/watch?v=K_wWZzELVec,I'm So Happy for Brendan Fraser,486
https://www.youtube.com/watch?v=s2b5ktQUFuo,AI Art is Nuts,647
https://www.youtube.com/watch?v=B8ZBe0H6Isg,I Got Called Out,516
