https://www.youtube.com/watch?v=cbSnzvUt7Xk,Moist Meter | Invader ZIM: Enter the Florpus,356
https://www.youtube.com/watch?v=HHzAnWaZaio,Bodyguard Competition,304
https://www.youtube.com/watch?v=vnRqQx_Dy4A,My Netflix Stand Up Comedy Routine,146
https://www.youtube.com/watch?v=36czgMAL-VY,Moist Meter | The Angry Birds Movie 2,235
https://www.youtube.com/watch?v=s1DnnGVOa40,Ex Picks Boyfriend,351
https://www.youtube.com/watch?v=Tpcmcvagnxs,All Horror Games Are The Same,581
https://www.youtube.com/watch?v=MZfU01YcKLE,Foot Fetish Wedding,446
https://www.youtube.com/watch?v=dmE827lgLjc,3AM Toy Story is Too Scary,510
https://www.youtube.com/watch?v=4iWWX1dmKXI,Blockbuster,887
https://www.youtube.com/watch?v=cBqcJjpweK8,Hardcore Wrestling,321
https://www.youtube.com/watch?v=XOmjZITQ5hg,The Worst Movie on Youtube,645
https://www.youtube.com/watch?v=Vr5GKg6uJfQ,Moist Meter | Scary Stories to Tell in the Dark,269
https://www.youtube.com/watch?v=yV817b7nQbY,Moist Meter | Dora and the Lost City of Gold,336
https://www.youtube.com/watch?v=lr_glxPo2yE,Tall Women and Prom,416
https://www.youtube.com/watch?v=qFPIcAYvDKI,Breaking Into Hitler's House,546
https://www.youtube.com/watch?v=eMmQncFMJz8,Polar Bear Police Force,668
https://www.youtube.com/watch?v=ORBCuBnRI5c,6 Sex Lords Try To Find The Secret Virgin,280
https://www.youtube.com/watch?v=xTItMy5EI2o,Neil deGrasse Tyson Is A Horrible Person,440
https://www.youtube.com/watch?v=wuTtaZ7aznM,Cursed Kids Show,307
https://www.youtube.com/watch?v=RwVkqYwAaO4,Moist Meter | Hobbs and Shaw,350
https://www.youtube.com/watch?v=XFD-27S5U8A,My Dogs Hate Keanu Reeves,281
https://www.youtube.com/watch?v=pqr4QuXbnD8,Moist Meter | The Boys,425
https://www.youtube.com/watch?v=6txa9KSitSg,Is Twitch Dying,591
https://www.youtube.com/watch?v=SrVvwGnQjGU,Killer Bees Are Dangerous,671
https://www.youtube.com/watch?v=BE_dmVx5j58,Psychicpebbles Funeral,133
https://www.youtube.com/watch?v=0-v5v91Y4U4,I Finally Tried Minecraft,377
https://www.youtube.com/watch?v=s2I-eC4w_Dc,Todd Howard Shows No Mercy,416
https://www.youtube.com/watch?v=KjRAbJADREk,Drunk Wrestling,339
https://www.youtube.com/watch?v=_1BCdrZBLW0,React Channel,487
https://www.youtube.com/watch?v=r_E5eu8HTOM,Cow Shit Throwing Competition,283
https://www.youtube.com/watch?v=4BFwP6Hyo_g,Moist Meter | Once Upon A Time In Hollywood,578
https://www.youtube.com/watch?v=gRg8nxzr2Mw,This Bodybuilder Will Change Your Universe,446
https://www.youtube.com/watch?v=0o7lIjoKNeI,Defeating Aliens With Kung Fu,1155
https://www.youtube.com/watch?v=FtZJoxkTGyo,Dog Steals A Man's Wife,386
https://www.youtube.com/watch?v=gVxdB0vDqYM,Allergic Hero Fights Wasps,426
https://www.youtube.com/watch?v=Kavm3Xa1C9k,Youtube Conspiracy Theory,634
https://www.youtube.com/watch?v=JGEbzF-p1I4,Tall Women and Marrying Short Men,356
https://www.youtube.com/watch?v=gRWAI6H4eZY,My Dad and I Built An Electric Mobile Throne,317
https://www.youtube.com/watch?v=d10IN0hCrw4,Burping Fetish,283
https://www.youtube.com/watch?v=Uaatd2ddcYM,Cats Looks Awful,251
https://www.youtube.com/watch?v=bBa7tXNMkY0,Moist Meter | The Lion King,424
https://www.youtube.com/watch?v=7LISx1eAJ8Q,Extreme Speed Dating,513
https://www.youtube.com/watch?v=LzDFYTa7mjo,I Created The Best Vape Trick,74
https://www.youtube.com/watch?v=Qw4xHTQHGwA,6 Vegans Try To Find The Secret Meat Eater,316
https://www.youtube.com/watch?v=uBzORCa08mo,6 Christians Try To Find The Secret Atheist,271
https://www.youtube.com/watch?v=Xb67bjpgEJE,Weaponized Toilet Brush,107
https://www.youtube.com/watch?v=G0sZBVm8r3Q,Moist Meter | Crawl,281
https://www.youtube.com/watch?v=glOJxdva-Sg,Area 51 Secrets Revealed,347
https://www.youtube.com/watch?v=Ujc4mfyCYu8,The Chad Gamer,411
https://www.youtube.com/watch?v=KSe_ERAknY0,I Grew 4 Inches in a Day,208
https://www.youtube.com/watch?v=8Sp0rIzuh6A,Slapping Face Massages,297
https://www.youtube.com/watch?v=TlGHB68au0c,Short Man Rage at Bagel Shop,357
https://www.youtube.com/watch?v=lJQdzK-3XZQ,Clown Fetish,386
https://www.youtube.com/watch?v=vegvV9fE6Lc,Tall Women and Short Men,547
https://www.youtube.com/watch?v=-E-VmC_nSkA,Moist Meter | One Punch Man,550
https://www.youtube.com/watch?v=NDeDueqAgAM,God Warrior of War,372
https://www.youtube.com/watch?v=lqldARa45eo,Moist Meter | Stranger Things,661
https://www.youtube.com/watch?v=0gHY6NT_6Ec,Samurai vs Dinosaur,99
https://www.youtube.com/watch?v=W83HhV-oHIU,This is What Perfect Fighting Technique Looks Like,334
https://www.youtube.com/watch?v=UZI60BHB4is,Why Can't Games Just Be Fun,514
https://www.youtube.com/watch?v=xgSRWn8iIGw,Destiny 2 Is An Easy Game,882
https://www.youtube.com/watch?v=hiw80m8rhR0,Comic Con Speed Dating,356
https://www.youtube.com/watch?v=HJSIzXKjfsA,God Warrior,700
https://www.youtube.com/watch?v=0AsCpZivRlo,I Won The Bottle Cap Challenge,192
https://www.youtube.com/watch?v=jRXAA1SHqOk,Moist Meter | Midsommar,374
https://www.youtube.com/watch?v=sJovHU03zNw,The Bible Is Hardcore,554
https://www.youtube.com/watch?v=1Csp94-r0_w,Moist Meter | Spider-Man: Far From Home,302
https://www.youtube.com/watch?v=ZjZ-9qsaL7s,Geek Love,637
https://www.youtube.com/watch?v=CuTMlyYn7Ps,My Dad and I Built The World's Fastest Gaming Chair,454
https://www.youtube.com/watch?v=85ggDJCV9FU,Moist Meter | Annabelle Comes Home,291
https://www.youtube.com/watch?v=V-Dmu1SK9o4,KPop Fans Scare Me,498
https://www.youtube.com/watch?v=s4mGOrbEKbs,A New Slapping Champion Has Arrived,720
https://www.youtube.com/watch?v=2QB1Ghekfb0,Jaystation Is The Biggest Douchebag,511
https://www.youtube.com/watch?v=yhntU9chIKk,Chad vs Redditor,461
https://www.youtube.com/watch?v=NJjLont7dQI,I Am The Best Player in Teamfight Tactics,971
https://www.youtube.com/watch?v=PhsixV8aaNM,Belle Delphine Has Betrayed Us,340
https://www.youtube.com/watch?v=oaSKumlfUBw,Science Has Gone Too Far,362
https://www.youtube.com/watch?v=v2dOXtm6Q3M,The Scariest Thing From My Childhood,255
https://www.youtube.com/watch?v=Mmny7gxv1PY,Moist Meter | Toy Story 4,290
https://www.youtube.com/watch?v=UKyEN6-xFIs,EA Invents Surprise Robberies,519
https://www.youtube.com/watch?v=ufFShqoFH78,Real Superheroes,569
https://www.youtube.com/watch?v=6eJInQ--GkA,I Am Not A Coward,243
https://www.youtube.com/watch?v=0qzEGETffSU,Strong Men Proving Crocodiles Are Pathetic,335
https://www.youtube.com/watch?v=6yEBCHeoluo,Mark Hamill's Worst Movie,445
https://www.youtube.com/watch?v=oyj0ijQlFNk,Sharkboy and Lavagirl is a Great Movie,325
https://www.youtube.com/watch?v=1nqy-uuSHbc,Woman Possessed By Cheesy Potato Demon,353
https://www.youtube.com/watch?v=rOI62axYVs8,Bibleman Saves The Internet,378
https://www.youtube.com/watch?v=MkY3x36LMb4,Thank You History Channel,356
https://www.youtube.com/watch?v=4marDxuVpmM,Moist Meter | Men In Black: International,383
https://www.youtube.com/watch?v=6ZAU0a4ZJg4,Fallout Battle Royale Is Awful,706
https://www.youtube.com/watch?v=5GiBolhyjcQ,Blacksmithing X Games,532
https://www.youtube.com/watch?v=AJM47UVOj0U,Bounty Hunters Bust A Redditor,293
https://www.youtube.com/watch?v=x1Tf6S5AvOQ,The Disturbing Truth Behind A Scooby-Doo Sound Effect,199
https://www.youtube.com/watch?v=vRXfyFFdtEk,Meat and French Fry Addict,514
https://www.youtube.com/watch?v=Oq8dS4vv6Sk,Exterminator Hunts Wasps and Gets Their Truck Stolen,473
https://www.youtube.com/watch?v=g8T7E5Hrc-E,The Biggest Announcement at E3,322
https://www.youtube.com/watch?v=mN9_KoKOeL8,Gamers Are Under Attack,401
https://www.youtube.com/watch?v=RTY26NANrXA,Almost Monster Hunter,388
https://www.youtube.com/watch?v=sfPxj8kpUG4,The Strongest Finger In The World,272
https://www.youtube.com/watch?v=w-tTXD-yKEA,Proof Superpowers Are Real,331
https://www.youtube.com/watch?v=A4FZlwv8aeA,Moist Meter | Dark Phoenix,296
https://www.youtube.com/watch?v=b3NBZjxgrDc,Forged In Furious Testosterone,476
https://www.youtube.com/watch?v=ZNY3gfHY7l8,Australian Facebook Is Mad At Me,437
https://www.youtube.com/watch?v=tWJhj6gTR04,Best Youtuber Stunt Man,297
https://www.youtube.com/watch?v=e0AeavKiCvk,Old Men Hate Gamers,312
https://www.youtube.com/watch?v=1lJhcmuMeBA,Killer Bean Is An Animated Masterpiece,1034
https://www.youtube.com/watch?v=ZGR92oxetBQ,Canadian Redneck Extreme Sports,325
https://www.youtube.com/watch?v=fwty978NNqM,Man Pretends To Be Psychic To Grope Women,254
https://www.youtube.com/watch?v=myH_vS97D6Y,Moist Meter | Ma,310
https://www.youtube.com/watch?v=RBWXzgZTL_k,I Took A DNA Test,228
https://www.youtube.com/watch?v=P4jG7wBVVnk,Waifu Souls,508
https://www.youtube.com/watch?v=2kVM7rFQIc8,The King of Slapping Enters Another Tournament,662
https://www.youtube.com/watch?v=WbM4jcD3Kk4,Moist Meter | Godzilla: King of the Monsters,249
https://www.youtube.com/watch?v=rpXoSvIjeYs,Vegan Music Is Scary,236
https://www.youtube.com/watch?v=4KY4Uqow8sw,The Super Turbo Mighty Cleaner,149
https://www.youtube.com/watch?v=SghrfWOOXMg,I Am The King of Card Games,788
https://www.youtube.com/watch?v=0y4tPd1EbcU,Backyard Wrestling Is The Best Sport,287
https://www.youtube.com/watch?v=GYUHaavC6Ug,Twitch Has A Big Secret,275
https://www.youtube.com/watch?v=JVfB0t2Z31g,I Don't Understand Mukbang Eating Videos,392
https://www.youtube.com/watch?v=ULhx9j_wnrA,Dumpster Diving for Friends,406
https://www.youtube.com/watch?v=BFtu5SC0kXo,Moist Meter | Brightburn,260
https://www.youtube.com/watch?v=9uxYvNd15uc,My Dad and I Built Something Incredible,328
https://www.youtube.com/watch?v=agYm_Xawb9I,Sound Healing Takes Humans to the Next Level,414
https://www.youtube.com/watch?v=t2kPB7_ptBU,Moist Meter | Aladdin,295
https://www.youtube.com/watch?v=ycAaMx77098,I Almost Killed Logan Paul,346
https://www.youtube.com/watch?v=ecup7Nt5b1o,Madman Fights Wasps With Pepper Spray,295
https://www.youtube.com/watch?v=_eIVjkNwlPc,Extreme Cheapskates Teach Valuable Lessons,312
https://www.youtube.com/watch?v=pDCpqmcDki0,Things I Hate About Internet Behavior,484
https://www.youtube.com/watch?v=NZ1A98laii4,Bulletproof Dog Whisperer,352
https://www.youtube.com/watch?v=t7AHEy2Am2Y,Humanity's Best Exterminator,537
https://www.youtube.com/watch?v=uqyKxdVa4zw,Proof Wrestling Is Real,296
https://www.youtube.com/watch?v=Q79LoZY83BE,Game of Thrones Season 8 Is Awful,530
https://www.youtube.com/watch?v=SJoRmA-V0fI,I'm The New Tati and James Charles,376
https://www.youtube.com/watch?v=VWRcm1X18T4,Plague Tale,412
https://www.youtube.com/watch?v=_aktyXRudwk,Horrible Youtube Cooking Show,486
https://www.youtube.com/watch?v=mWf9Uz-tMw4,Pathetic Pranks,382
https://www.youtube.com/watch?v=EbKXrzMDlBs,The Scary Side of Fortnite,409
https://www.youtube.com/watch?v=UoeH7IsK7Pg,Rage 2 Is Not Good,368
https://www.youtube.com/watch?v=T3sAYuOsqbA,The Worst Chef on Youtube,534
https://www.youtube.com/watch?v=Pm6HxvYeIFY,Secret Spider-Man Training Video,519
https://www.youtube.com/watch?v=D-thBta_56U,Professional Cuddlers,323
https://www.youtube.com/watch?v=C0_kBFaFVO4,A Mop For Redditors,137
https://www.youtube.com/watch?v=lfUfWTqwB7c,Dog Whispering Is The Most Dangerous Job,284
https://www.youtube.com/watch?v=UIDstyKdtrg,Moist Meter | Pokmon: Detective Pikachu,197
https://www.youtube.com/watch?v=Xjo-8kGe2qw,Slapping Tournaments Are For Real Men,540
https://www.youtube.com/watch?v=lhG6CGTXawY,The Most Disturbing Prank Ever,374
https://www.youtube.com/watch?v=vVpk3v1d5SM,A Masterpiece Gamers Forgot | Finale,901
https://www.youtube.com/watch?v=4O_OKZKltrM,Game of Thrones Is A Joke Now,498
https://www.youtube.com/watch?v=gD7-41uGb-Y,The Freakiest Eaters,798
https://www.youtube.com/watch?v=mDwwXeHtuo4,A Masterpiece Gamers Forgot,954
https://www.youtube.com/watch?v=zJ24eWa_vjQ,Professional Rock Paper Scissors,165
https://www.youtube.com/watch?v=fLJvMWJnCck,Mountain Monsters Is The Best Show,410
https://www.youtube.com/watch?v=bZdl8qg7ix0,I Got A New Puppy,57
https://www.youtube.com/watch?v=jF8RXC1FznI,Moist Meter | Game of Thrones Season 5,395
https://www.youtube.com/watch?v=OsuoqSnJVc0,A Kitchen's Worst Nightmare,772
https://www.youtube.com/watch?v=T4KHpo6hEEA,I Bite Hot Peppers For Every Bad Scene In Sonic The Hedgehog Trailer,252
https://www.youtube.com/watch?v=X1AOaZMPkzo,Mordhau King of Combat,359
https://www.youtube.com/watch?v=mqBw_6hU-Mw,Bran Is The Worst Character In Game of Thrones,463
https://www.youtube.com/watch?v=7McBE5rGh80,Video Game Commercials Used To Be Good,264
https://www.youtube.com/watch?v=t-LnuykOdG4,World of Warcraft Is A Scam,387
https://www.youtube.com/watch?v=tkc2QjpVu5w,My Strange Addiction Isn't Strange,379
https://www.youtube.com/watch?v=hAPZl1Jlcho,Defending Earth From Cockroaches and Robots | EDF Iron Rain,542
https://www.youtube.com/watch?v=rvk_jVas3Lg,Soap or Die,492
https://www.youtube.com/watch?v=RpNg5k0UFy8,Moist Meter | Avengers: Endgame,501
https://www.youtube.com/watch?v=Q09yJgmznVM,Moist Meter | Mortal Kombat 11,568
https://www.youtube.com/watch?v=nLCbhHu8JdI,Why Apex Legends Is Dying,579
https://www.youtube.com/watch?v=V0qfSzcGFbQ,Moist Meter | Game of Thrones Season 4,429
https://www.youtube.com/watch?v=PODzum4jW1M,Perfect Body Armor,301
https://www.youtube.com/watch?v=W9XWnGoFwvM,Bullet Witch,640
https://www.youtube.com/watch?v=xN1lhvlyUKg,The Farty McSharty Pants,94
https://www.youtube.com/watch?v=RIy3cFnqd0A,Moist Meter | Game of Thrones Season 3,356
https://www.youtube.com/watch?v=gguNMVtuQ1Q,Celebrating Easter The Right Way,242
https://www.youtube.com/watch?v=EZEoCJyPou8,Moist Meter | The Curse of La Llorona,238
https://www.youtube.com/watch?v=aWudYmxO34Y,Gaming Journalism Is A Joke,351
https://www.youtube.com/watch?v=aRpzjYUeFfU,Shield Souls,350
https://www.youtube.com/watch?v=OXrYN3nCXOU,The Most Pathetic Youtuber,436
https://www.youtube.com/watch?v=A2WbnAgZBSY,Moist Meter | Game of Thrones Season 2,404
https://www.youtube.com/watch?v=CXui8c7y4b8,Almost Left 4 Dead 3,323
https://www.youtube.com/watch?v=t9ard8Ojokk,I Don't Like Genius Lyric Breakdown Series,300
https://www.youtube.com/watch?v=tGNuhczBljw,Moist Meter | Game of Thrones Season 1,568
https://www.youtube.com/watch?v=REaYUKp2FNQ,Youtube Keeps Recommending Porn,219
https://www.youtube.com/watch?v=lu5CkorAwJs,Moist Meter | Mob Psycho 100,329
https://www.youtube.com/watch?v=AXm1gJgHhEY,Cute Stuff,243
https://www.youtube.com/watch?v=sKXa-KiIYVU,Moist Meter | Hellboy,361
https://www.youtube.com/watch?v=4SiiRx7GDzI,The Gentle Men - 2019 Guy,198
https://www.youtube.com/watch?v=FbiNFp5uJII,Lynel Are Easy,287
https://www.youtube.com/watch?v=YGe3ympcGpk,The Worst Wedding of All Time,279
https://www.youtube.com/watch?v=MWF2lARXqBs,Riverdale | Thickening Plot,257
https://www.youtube.com/watch?v=Dr_GW7K06aE,Haircut and Riverdale Announcement,207
https://www.youtube.com/watch?v=ciH_GKepKgI,Carl Wheezer Is The Champion of Retroville,405
https://www.youtube.com/watch?v=RuUI9gVClZU,Youtuber Pranks Mom With A Used Condom,340
https://www.youtube.com/watch?v=apsxz1gTVpI,The Weirdest Short Film Ever Made,941
https://www.youtube.com/watch?v=dAaw3g08K4A,Oddly Satisfying Videos Are Not Satisfying,263
https://www.youtube.com/watch?v=hSzMUK2rxVo,I Got A World Record,86
https://www.youtube.com/watch?v=93ksdQm-0ho,Moist Meter | Pet Sematary,214
https://www.youtube.com/watch?v=QBIzdqLP0fw,What Happened To The Real Series,309
https://www.youtube.com/watch?v=svbwj6-67AY,Moist Meter | Shazam,329
https://www.youtube.com/watch?v=lucRvvB15IU,Sekiro | Hardest Final Boss,684
https://www.youtube.com/watch?v=JxFG755b4EU,"Moist Meter | Billie Eilish - When We All Fall Asleep, Where Do We Go",246
https://www.youtube.com/watch?v=9yQdC-w5sGE,Sekiro | Smooth Speedrun,632
https://www.youtube.com/watch?v=x27MKOIkOQI,How Strong Is An Alien Vagina,146
https://www.youtube.com/watch?v=c7iUkYLzkww,Sekiro | Very Easy Game,652
https://www.youtube.com/watch?v=iKYVtBG247c,When Two Youtubers Make A Video On The Same Topic,280
https://www.youtube.com/watch?v=K-9g6a16TU0,SNL Is Awful,232
https://www.youtube.com/watch?v=K4E4RQD4yew,Boring Douchetubers,473
https://www.youtube.com/watch?v=KZactO85g04,Carrying Dizzy and Aceu,294
https://www.youtube.com/watch?v=bfXAleOy7E8,The Most Important Scene In Movie History,359
https://www.youtube.com/watch?v=aXYZdD_OeC8,Sekiro | First Try Everything,479
https://www.youtube.com/watch?v=k5FcL99NuB8,Discord Is Embarrassing,468
https://www.youtube.com/watch?v=6v3Sq9Fdfdk,"Not Last Place in $100,000 Tournament",444
https://www.youtube.com/watch?v=_Zx3hVet968,The Worst Video I Ever Made,296
https://www.youtube.com/watch?v=A2_IDU-gGd8,Master Swordsman Tests Sekiro Blade,237
https://www.youtube.com/watch?v=TJCFxixXzxI,Moist Meter | Sekiro: Shadows Die Twice,542
https://www.youtube.com/watch?v=lp9XrG8hjyo,Checking In On My Favorite Youtube Couple,248
https://www.youtube.com/watch?v=HBRk7AGIQuY,How To Be Irrestible At The Bar,255
https://www.youtube.com/watch?v=ln8q7vXFH9Y,Meeting The Fish Village,336
https://www.youtube.com/watch?v=8shzb5MekHw,Moist Meter | Us,505
https://www.youtube.com/watch?v=k3K9nM1LNP0,Sekiro Is An Easy Game,392
https://www.youtube.com/watch?v=LFlsHKpdk00,Review of Amy Schumer's New Netflix Special,275
https://www.youtube.com/watch?v=aQSSSwa5qx8,The Worst Joke Told By A Youtuber,289
https://www.youtube.com/watch?v=o0MP5AQLC-Q,Man Saves Wedding By Fainting and Peeing,300
https://www.youtube.com/watch?v=1zhd5HvHNe0,Wet Dreams Are For Real Men,98
https://www.youtube.com/watch?v=unTDdJoqU1o,Defeating An Oral Sex Demon,412
https://www.youtube.com/watch?v=yLT_2AGr1fY,"I Watched The Same Porn Video For 2 Years, Here's What Happened",355
https://www.youtube.com/watch?v=5NkwKmEZjs8,Mario Odyssey and Body Fluid,315
https://www.youtube.com/watch?v=44o5XsPZAp0,Teaching A Puppy Some Cool Things,46
https://www.youtube.com/watch?v=02SJVxvdoUk,The 3rd Biggest Youtube Channel Is Horrible,317
https://www.youtube.com/watch?v=vWNfFlXOF58,Anti-Vaxxers Are Worse Than Flat Earthers,484
https://www.youtube.com/watch?v=Ufiptz9HbFE,Hyrule Gets Very Anime,279
https://www.youtube.com/watch?v=gB4KaiAkB2o,Moist Meter | Devil May Cry 5,430
https://www.youtube.com/watch?v=DRn2E9XT7Vc,Why Don't I Play Shitty Games Anymore,271
https://www.youtube.com/watch?v=Kgl2wuGAnfU,Jupiter Technology,91
https://www.youtube.com/watch?v=kFu660mP9EM,Moist Meter | Captain Marvel,381
https://www.youtube.com/watch?v=70aTXgcQ5bs,Metal Gear Sodden,254
https://www.youtube.com/watch?v=HeowaGQPjYE,Elon Musk In Devil May Cry 5,362
https://www.youtube.com/watch?v=q8PYt-TDOO8,Twitch Streamers Bait Donations By Breaking Up With Their Girlfriends,526
https://www.youtube.com/watch?v=jUgziRBHabg,Metal Gear Not Solid,512
https://www.youtube.com/watch?v=cbBpTGgqtbM,BuzzFeed Pulls Crazy Prank That Nearly Kills 6 People,324
https://www.youtube.com/watch?v=yF6IbvN7JVI,Yu-Gi-Oh Was Insane,493
https://www.youtube.com/watch?v=XPHz6_T3wvg,Mr. Krabs vs Mr. Krabs,496
https://www.youtube.com/watch?v=VOWVpaQ5qgE,Answering Google's Top Questions About Me,218
https://www.youtube.com/watch?v=r6vBHDW55_0,Orgasm From A Hug,199
https://www.youtube.com/watch?v=LyOvLeNe92I,Fake Giveaways and Scams,366
https://www.youtube.com/watch?v=xoCacS5z79o,Horrible DoucheTuber Prank,581
https://www.youtube.com/watch?v=SVf6slyfw2E,Archangel Doug Dimmadome,488
https://www.youtube.com/watch?v=t28Ibor0LzE,Master of Funerals,383
https://www.youtube.com/watch?v=5o2CQtjndms,One of My Most Embarrassing Stories,505
https://www.youtube.com/watch?v=K5JhFHJkRyE,Hyrule Stunts,261
https://www.youtube.com/watch?v=lprOnsRLUgg,Drunk Friend Simulator,477
https://www.youtube.com/watch?v=efvafFG7UDk,RIP Youtube Comment Section,392
https://www.youtube.com/watch?v=gkhvhsoFVFM,A Button To Improve Your Sex Life,322
https://www.youtube.com/watch?v=6flU03yxOas,"Last Place in $100,000 Tournament | Part 3",468
https://www.youtube.com/watch?v=LEqai_ltKj4,Pies On Face Are Hot,455
https://www.youtube.com/watch?v=CXuASYnKWKM,"Last Place in $100,000 Tournament | Part 2",642
https://www.youtube.com/watch?v=HenR0ZMPCgk,"Last Place in $100,000 Tournament | Part 1",460
https://www.youtube.com/watch?v=QYsa5NrLwug,Teaching Jacksepticeye How To Master Apex Legends,697
https://www.youtube.com/watch?v=Qki-tWCp8vA,Moist Meter | Anthem,575
https://www.youtube.com/watch?v=rj-wXUoOYZc,The Worst Product Ever Created,330
https://www.youtube.com/watch?v=pOss5aNadV0,Anthony Sullivan Destroys Stuart Little,398
https://www.youtube.com/watch?v=Wq_DAFod68g,My Secret Talent,223
https://www.youtube.com/watch?v=CefYeu1ej4Y,Moist Meter | Happy Death Day 2U,238
https://www.youtube.com/watch?v=a4MiA-Ej_Hk,Very Wet Win Streak in Apex Legends,608
https://www.youtube.com/watch?v=Ppz8XR2hy94,Riley Reid Enters Anime,360
https://www.youtube.com/watch?v=jg2uvjp41xM,Runescape's First Monopoly,317
https://www.youtube.com/watch?v=8p7AVK43aeU,Moist Meter | Alita: Battle Angel,378
https://www.youtube.com/watch?v=XNixFyaKYrY,Jump Force Has The Worst Cutscenes,241
https://www.youtube.com/watch?v=Nagbjwhj5r8,New Aladdin Looks Bad,302
https://www.youtube.com/watch?v=Z_FAwzT_nwo,BOTW Master,371
https://www.youtube.com/watch?v=IJRUoO-WQo4,Moist Meter | The Prodigy,277
https://www.youtube.com/watch?v=5slvEThJzJg,How To Tie A Tie Fast,177
https://www.youtube.com/watch?v=UKfzCE0LdWc,Moist Meter | LEGO Movie 2,242
https://www.youtube.com/watch?v=p8hiBiFSmOw,The Division 2 Elite Squad,593
https://www.youtube.com/watch?v=67NiX6KrmR4,The Nothing Fucking Sticks Pan,113
https://www.youtube.com/watch?v=eSUENHE_Y4s,Cursed Apex Legends Game,335
https://www.youtube.com/watch?v=jR7AKm7Ywyg,Moist Meter | Apex Legends,464
https://www.youtube.com/watch?v=iZV9ilpgom4,Why I'm Banned From Vimeo,351
https://www.youtube.com/watch?v=DrATjeZ2dOI,I've Already Mastered Apex Legends,723
https://www.youtube.com/watch?v=XLA_fW89nPY,Anthem Is Awful | Part 5,709
https://www.youtube.com/watch?v=zYIeVFHxe28,Pickup Artist Classes Are Pathetic,631
https://www.youtube.com/watch?v=ShD6bj91238,Nice Pecs Von AssRipper,304
https://www.youtube.com/watch?v=guQxRe0yzTo,Anthem Is Awful | Part 4,426
https://www.youtube.com/watch?v=wA5aLndcaD0,Real People Not Actors vs Grizzly Bear,94
https://www.youtube.com/watch?v=WzHj2yGH6cA,From Tutorial To Ganon,524
https://www.youtube.com/watch?v=pLxi_P9Bkd0,Moist Meter | Kingdom Hearts 3,627
https://www.youtube.com/watch?v=xQ1_IwQwWvI,Moist Meter | Resident Evil 2 Remake,442
https://www.youtube.com/watch?v=dzl3dGZf3Ns,Kingdom Hearts 3 First Hour,384
https://www.youtube.com/watch?v=uo0jY_lRpp8,The Worst Broom Ever,274
https://www.youtube.com/watch?v=LDZo-bT_tAk,Leon Saves The City,474
https://www.youtube.com/watch?v=CeFq2g3J7YY,Leon Goes Hard,505
https://www.youtube.com/watch?v=BU424eG4NgY,Real People Not Actors vs Alligators,235
https://www.youtube.com/watch?v=hl_BmsZBLoE,Anthem Is Awful | Part 3,1030
https://www.youtube.com/watch?v=Y_e4yFDeOfg,Anthem Is Awful | Part 2,392
https://www.youtube.com/watch?v=WpBlsFt-72Y,Anthem Is Awful | Part 1,611
https://www.youtube.com/watch?v=2aZYs2F3wSI,"Found This On My Computer, Forgot That I Played It",324
https://www.youtube.com/watch?v=VZWQxhxBVHE,Why Am I So Negative,546
https://www.youtube.com/watch?v=HfZLcKzyP28,Biggest Arrest of 2019,162
https://www.youtube.com/watch?v=CrzzHg9TVe0,The Soothing Sounds of Two Huskies Hanging Out,69
https://www.youtube.com/watch?v=aq10OHxnHAM,Nipple Demon Awakens,527
https://www.youtube.com/watch?v=RYOaZC1XgxY,Brave Men Prank Their Friend With A Dementia Potion,430
https://www.youtube.com/watch?v=Z0wALHFGvHc,Breath of the Wild Prodigy,410
https://www.youtube.com/watch?v=dyJtNusDT0k,I Don't Like The Fine Bros React Series,446
https://www.youtube.com/watch?v=J3zXCl1zC1c,Moist Meter | Dragon Ball Super: Broly,365
https://www.youtube.com/watch?v=lXgYp92CNGQ,This Freestyle Rapper Changed The Game,290
https://www.youtube.com/watch?v=C8qtIDZoFR4,Moist Meter | Glass,527
https://www.youtube.com/watch?v=6ECEWuShOFw,Opera Duet With My Dog,95
https://www.youtube.com/watch?v=Mb5oX9ItJMY,Resident Evil 2 Remake Demo,292
https://www.youtube.com/watch?v=dxHHqJQas8M,Moist Meter | Replicas,371
https://www.youtube.com/watch?v=k9kBzVe9l_U,Taking Out Sean Bean,442
https://www.youtube.com/watch?v=kHQHFm8KRYE,The 5 Best Movies of 2018,457
https://www.youtube.com/watch?v=Eg_g57pyt_o,Gearbox CEO Watches Porn To Learn Magic Tricks,617
https://www.youtube.com/watch?v=Cb6lJo0Z4z0,The Best 5 Games of 2018,491
https://www.youtube.com/watch?v=aknpvuZWhKs,The Legend of The Noid,425
https://www.youtube.com/watch?v=IBq01ksnflI,R. Kelly Is Bad,319
https://www.youtube.com/watch?v=33G5zskD0mU,Moist Meter | Escape Room,218
https://www.youtube.com/watch?v=fTikbldty9g,Do I Script Shit,209
https://www.youtube.com/watch?v=39vqXsNSr_8,The 5 Worst Movies of 2018,413
https://www.youtube.com/watch?v=JWvXWgabkEU,The Worst 5 Games of 2018,541
https://www.youtube.com/watch?v=bq6_TA-Tmdg,Ricegum Drama,441
https://www.youtube.com/watch?v=AmJvucyyhng,God of CSGO Battle Royale,389
https://www.youtube.com/watch?v=c9rck90q0W4,Moist Meter | Bird Box,386
https://www.youtube.com/watch?v=089YwSnCLCc,I Beat Runescape,176
https://www.youtube.com/watch?v=kParY8ex9QM,Moist Meter | Bandersnatch,275
https://www.youtube.com/watch?v=WhnuiBSquuI,Moist Meter | Goblin Slayer,306
https://www.youtube.com/watch?v=9-8XoFNsKjI,Interview With The Worst Smash Ultimate Player,519
https://www.youtube.com/watch?v=aO5rX6aJiUM,Postman Dale Is The Best Video Game Character,422
https://www.youtube.com/watch?v=jVxJBGRN4M0,I Almost Ruined Christmas By Taking A Big Shit,262
https://www.youtube.com/watch?v=GQl5LaXoFZc,Moist Meter | Holmes and Watson,121
https://www.youtube.com/watch?v=rrq-cTAA2Zk,Anthony Sullivan Is Thirsty,375
https://www.youtube.com/watch?v=yMr4YN2eY1Y,An Angel Is Born,438
